{"acceptance_commands":["python3 -c 'import pathlib,sys; sys.exit(0 if pathlib.Path(\"dogfood.txt\").is_file() else 1)'"],"checkpoint_message":"Complete task_1: Exercise one production checkpoint","dependencies":[],"file_claims":["dogfood.txt"],"forbidden_paths":["run_manifest.json","events.jsonl","state.json"],"required_evidence":[],"required_methods":["using-superpowers"],"risk_class":"high","schema_version":"cpe.task-contract.v4","source_hashes":{"plan":"6718ca2ec2d6730df81e04904790776d68285638ed28c63b74d5011850a2c292","spec_sections":{}},"spec_sections":[],"task_id":"task_1","task_source":"### Task 1: Exercise one production checkpoint\n```yaml\ntask_type: non_tdd_implementation\ndependencies: []\nfile_claims: [dogfood.txt]\nacceptance: [\"python3 -c 'import pathlib,sys; sys.exit(0 if pathlib.Path(\\\"dogfood.txt\\\").is_file() else 1)'\"]\n```\n","task_source_sha256":"cfe3e8d36ad9c5b12546a85373fd98acf22a93e0202c49aed09fb0ce09cfd0b1","task_type":"non_tdd_implementation","title":"Exercise one production checkpoint"}
